{
  "schema_version": "1.0",
  "session": {
    "id": "demo-import",
    "project": "Asset studio — SYNTHETIC DEMO",
    "scope": "Proposal review: understand the partial result of an import. This is not an audit of a real product.",
    "mode": "design",
    "language": "en",
    "created_on": "2026-09-05",
    "authorized_changes": "Local demo artifacts only. No remote changes.",
    "limitations": [
      "There were no participants, analytics, or backend execution.",
      "The figures illustrate synthetic counts, not a measured improvement."
    ]
  },
  "conclusion": {
    "status": "proposed",
    "summary": "Propose a persistent summary of partial results and a retry of pending items only. Hypothesis pending human validation."
  },
  "evidence": [
    {
      "id": "E-01",
      "kind": "simulation",
      "location": "Conceptual example included in this package",
      "description": "Simulated import with completed, rejected, and pending items. This is not an observation of people.",
      "observed_on": "2026-09-05"
    }
  ],
  "coverage": [
    {
      "id": "C-01",
      "dimension": "Understanding of the partial state",
      "claim_kind": "human",
      "scope": "Identify what was imported and what needs correction",
      "status": "unknown",
      "reason": "No test with participants was run.",
      "evidence_ids": []
    },
    {
      "id": "C-02",
      "dimension": "Retry idempotency",
      "claim_kind": "interaction",
      "scope": "Do not duplicate items already imported",
      "status": "unknown",
      "reason": "The example does not implement a backend.",
      "evidence_ids": []
    }
  ],
  "findings": [
    {
      "id": "UX-01",
      "title": "The partial result needs a state the person can consult",
      "task": "Import a selection and recover only what is pending",
      "state": "partial",
      "observation": "The initial proposal only considered a transient notification; this raises the risk of losing context.",
      "classification": "hypothesis",
      "claim_kind": "human",
      "impact": "Work could be repeated, or the result could be read as a complete failure.",
      "severity": "P1",
      "confidence": "low",
      "reach": "Unknown; there is no product data.",
      "evidence_ids": [
        "E-01"
      ],
      "principle_ids": [
        "ATT-03",
        "INT-02",
        "AI-05"
      ],
      "source_ids": [
        "NN-CHANGE",
        "AI-PAIR"
      ],
      "proposal": "Keep a list of completed, failed, and pending items; retry only the selected ones and check the result.",
      "tradeoff": "The summary takes up space; do not turn it into permanent noise.",
      "acceptance_test": "Without hints, the person identifies the results and retries only what failed; a technical test checks that effects are not duplicated.",
      "status": "planned",
      "resolution": "",
      "verification_evidence_ids": []
    }
  ],
  "metrics": [
    {
      "id": "M-01",
      "name": "Correct task without reimporting completed items",
      "kind": "human",
      "status": "planned",
      "unit": "proportion",
      "baseline": null,
      "result": null,
      "sample_size": null,
      "population": "Relevant users of the future product, to be recruited with consent",
      "method": "Comparative task test; size and decision criterion to be defined before running",
      "comparison": true,
      "evidence_ids": []
    }
  ],
  "decisions": [
    {
      "id": "D-01",
      "question": "Toast or persistent summary?",
      "choice": "Prototype a persistent summary and compare",
      "rationale": "The task continues after the message; the proposal lets the person consult the state.",
      "alternatives": [
        "Toast with a link to the history",
        "Import view with per-row status"
      ],
      "risk": "Adding unnecessary visual containment if a sufficient history already exists",
      "owner": "To be agreed",
      "review_trigger": "Inspection of the real product or task-test evidence"
    }
  ],
  "additional_sources": []
}
